discussion_topic,podcast_title,podcast_influence,session_date
The topic of discussion at Lee's Market's lunch and learn sessions.,The title of Jason Wong's favorite podcast in 2025.,How the podcast influenced the discussion topic at Lee's Market's lunch and learn sessions.,The date of the lunch and learn session at Lee's Market.
Employee Wellness,Workplace Wellness,The podcast led to discussions on employee wellness and how to create a healthier work environment.,2025-09-10
Digital Marketing Strategies,Digital Domination,The podcast sparked ideas on how to enhance the market's digital marketing strategies.,2025-10-25
Innovation in Retail,Retail Revolution,The podcast sparked ideas on how to innovate retail processes in the market.,2025-03-15
Local Produce Promotion,Local is Lekker,The podcast encouraged discussions on promoting local produce and supporting local farmers.,2025-08-15
Financial Management,Money Matters,The podcast led to more discussions on financial management and budgeting.,2025-06-30
Sustainable Business Practices,Green Economy,The podcast influenced discussions on sustainability and eco-friendly business practices.,2025-02-20
Organic Farming,Farming Today,The podcast inspired discussions on the benefits of organic farming and how to source organic produce.,2025-05-25
Food Security,Food For Thought,"The podcast raised awareness about food security, leading to discussions on how the market can contribute to the cause.",2025-07-20
Healthy Eating Habits,Health 101,The podcast encouraged more discussions on healthy food options in the market.,2025-01-05
Influence of Podcasts on Discussion Topics,Jason Wong's Top Picks 2025,"Jason Wong's integrated podcasts in 2025 highlight monthly learning sessions, prompting staff to share ideas and inspirational stories.",2025-12-31
Customer Service Excellence,Customer is King,"The podcast emphasized the importance of customer service, leading to discussions on how to improve in this area.",2025-04-10
