task_id,dr_question,url,url_date,persona,industry,company,domain,n_supporting,n_distractor
DR0001,How can Lee's Market leverage FSMA 204 regulations to enhance food safety and customer trust?,https://www.grocerydive.com/spons/grocers-talk-fsma-204-compliance-food-safety-and-the-future-of-grocery/722810/,2024-08-05,Emily Patel,retail,Lee's Market,compliance,3,7
DR0002,How can personalization drive sales in the retail industry and what strategies can be used for Lee's Market in action?,https://www.bcg.com/publications/2024/personalization-in-action,2024-11-18,Michael Lee,retail,Lee's Market,sales,4,10
DR0003,How can we leverage data-driven loyalty programs to enhance customer engagement?,https://eagleeye.com/blog/grocery-loyalty-inflation-data-growth,2025-08-01,David Lee,retail,Lee's Market,crm,7,15
DR0004,What are the new trends in the grocery retail market and what strategies can Lee's Market adopt to remain competitive?,https://www.grocerydive.com/news/grocery-trends-outlook-2025/738623/,2025-01-31,Sofia Patel,retail,Lee's Market,market_analysis,6,14
DR0005,How can Lee's Market leverage chatbots to enhance the consumer experience for centennial shoppers?,https://www.grocerydoppio.com/articles/chatbots-improving-seamless-interactions-between-grocers-and-centennials,2023-05-03,David Thompson,retail,Lee's Market,csm,16,33
DR0006,"What are the key factors influencing MediConn Solutions' decision to accept insurance for telehealth providers, considering HIPAA compliance and state-specific data privacy regulations?",https://www.healthcaredive.com/news/telehealth-providers-crossroads-regulations-paul-schmeltzer-clark-hill/727296/,2024-09-20,Samantha Lee,healthcare,MediConn Solutions,compliance,4,8
DR0007,How can we leverage ISTM and AI-driven analytics to minimize IT service desk workload and improve response times in MediConn Solutions?,https://www.topdesk.com/en/blog/itsm-healthcare/,2025-01-23,Emily Patel,healthcare,MediConn Solutions,itsm,6,12
DR0008,"What is the impact of third-party data breaches on MediConn's virtual healthcare platforms and patient data, and what new regulations can be implemented to defend against these breaches?",https://www.aha.org/news/aha-cyber-intel/2024-10-07-look-2024s-health-care-cybersecurity-challenges,2024-10-07,Brian Smith,healthcare,MediConn Solutions,cybersecurity,7,14
DR0009,"How can MediConn Solutions leverage trendy new CRM solutions to improve patient engagement and retention, and what new CRM solutions are expected in 2025?",https://wtt-solutions.com/blog/the-future-of-healthcare-crm-solutions-what-to-expect-in-2025,2025-03-11,Liam Patel,healthcare,MediConn Solutions,crm,12,24
DR0010,"What are the most critical elements of a robust digital presence for a telehealth provider such as MediConn Solutions, and how can we optimize our website and content marketing strategy to attract digital-first patients?",https://marketinginsidergroup.com/marketing-strategy/how-to-market-telehealth-services-to-connect-with-digital-first-patients/,2025-06-25,Ryan Thompson,healthcare,MediConn Solutions,marketing,15,30
DR0011,"How can we balance the need for durability and warranty guarantees for EV batteries with evolving regulatory requirements, especially ACC regulations (ACC II), while staying on track with our production timelines through 2035?",https://www.wardsauto.com/regulatory/ev-regulations-continue-evolving,2024-03-15,Sofia Rodriguez,automobiles,Elexion Automotive,compliance,3,6
DR0012,"How can Elexion Automotive’s quality assurance processes be optimized to address the unique challenges of electric vehicle production, such as software and user experience issues, compared to gasoline cars?",https://www.greencars.com/expert-insights/do-evs-have-more-quality-problems,2024-07-18,Ethan Smith,automobiles,Elexion Automotive,quality_assurance,3,6
DR0013,"How can Elexion Automotive effectively implement a cybersecurity strategy for its electric vehicles, considering the risks and challenges posed by connected and autonomous technologies?",https://www.helpnetsecurity.com/2025/04/04/cybersecurity-risks-cars/,2025-04-04,Ethan Thompson,automobiles,Elexion Automotive,cybersecurity,6,12
DR0014,Can we leverage AI-enhanced battery management to improve EV battery lifespan by 15%?,https://www.here.com/learn/blog/how-ai-optimizes-electric-vehicles,2024-08-19,Liam Chen,automobiles,Elexion Automotive,research,7,14
DR0015,How can Elexion Automotive increase customer trust through after-sales support while balancing the need for exceptional customer care with efficient and cost-effective service?,https://theevreport.com/enhancing-ev-trust-through-aftersales-support,2024-08-19,Ryan Thompson,automobiles,Elexion Automotive,csm,15,30
