Company,Department,Initiative_Name,Launch_Year,Description
The name of the company that launched the initiative,The department(s) involved in launching the initiative,The name of the initiative launched,The year when the initiative was launched,A brief description of the initiative
Epsilon Systems,R&D,Product Innovation,2019,Launching a new initiative for product innovation
Alpha Tech,Marketing,Social Media Revamp,2020,Revamping the social media presence of the company
Beta Corp,Finance,Automated Reporting,2023,Implementing automated financial reporting system
Eta Solutions,HR,Employee Wellness,2020,Introducing a new employee wellness program
Delta Enterprises,IT,Cyber Security Update,2022,Upgrading the company's cyber security system
Gamma Inc,HR,Diversity Training,2021,Introducing mandatory diversity training for all employees
Iota Limited,Finance,Budget Optimization,2021,Implementing a new budget optimization system
Theta Networks,IT,Cloud Migration,2023,Migrating all data to the cloud
Zeta Services,Sales,CRM Implementation,2024,Implementing a new CRM system
MediConn Solutions,"HR, IT",Tech-Wellness,2025,Promote balanced screen time and mental well-being of employees
